{
  "calendar": "gregorian",
  "captureSource": "app",
  "contractVersion": 1,
  "createdAt": 1700000000000,
  "operation": "newNote",
  "payloads": [
    {
      "id": "22222222-2222-4222-8222-222222222222",
      "kind": "text",
      "text": "Synthetic capture text."
    }
  ],
  "preset": {
    "id": "33333333-3333-4333-8333-333333333333",
    "retryMarkerPolicy": "voxCaptureCommentV1",
    "revision": 7,
    "snapshotHash": "0000000000000000000000000000000000000000000000000000000000000000",
    "templateFreezePoint": "firstPreparation"
  },
  "requestID": "11111111-1111-4111-8111-111111111111",
  "routePolicy": {
    "collisionPolicy": "reuseIfHashMatches",
    "logicalFolder": [
      "Synthetic Vault",
      "Inbox"
    ]
  },
  "timezone": "America/Los_Angeles"
}
